{
  "schemaVersion": "1",
  "computedAt": "2026-07-01T12:00:00.000Z",
  "headSha": "aaaaaaaaaaaaaaaaaaaaaaaaaaaaaaaaaaaaaaaa",
  "sourceSignalCount": 2,
  "eras": [
    {
      "id": "era:01HBOOTSTRAP",
      "name": "Bootstrap era",
      "summary": "Initial project setup and core scaffolding.",
      "startCommitSha": "aaaaaaaaaaaaaaaaaaaaaaaaaaaaaaaaaaaaaaaa",
      "endCommitSha": "bbbbbbbbbbbbbbbbbbbbbbbbbbbbbbbbbbbbbbbb",
      "startAt": 1700000000000,
      "endAt": 1700000100000,
      "signalIds": [1],
      "inflections": [
        {
          "type": "tech_pivot",
          "title": "Monorepo adoption",
          "description": "Project structure shifted to a TypeScript monorepo layout.",
          "evidence": [
            {
              "type": "file",
              "path": "src/main.ts",
              "commitSha": "aaaaaaaaaaaaaaaaaaaaaaaaaaaaaaaaaaaaaaaa"
            }
          ]
        }
      ],
      "claims": [
        {
          "text": "Core modules were established in the first indexed commits.",
          "evidence": [
            {
              "type": "commit",
              "sha": "aaaaaaaaaaaaaaaaaaaaaaaaaaaaaaaaaaaaaaaa"
            }
          ]
        }
      ],
      "evidence": [
        {
          "type": "commit",
          "sha": "aaaaaaaaaaaaaaaaaaaaaaaaaaaaaaaaaaaaaaaa"
        },
        {
          "type": "file",
          "path": "src/main.ts",
          "commitSha": "aaaaaaaaaaaaaaaaaaaaaaaaaaaaaaaaaaaaaaaa"
        }
      ]
    },
    {
      "id": "era:01HGROWTH",
      "name": "Growth era",
      "summary": "Feature expansion and documentation updates.",
      "startCommitSha": "bbbbbbbbbbbbbbbbbbbbbbbbbbbbbbbbbbbbbbbb",
      "endCommitSha": "cccccccccccccccccccccccccccccccccccccccc",
      "startAt": 1700000100000,
      "endAt": 1700000200000,
      "signalIds": [2],
      "inflections": [
        {
          "type": "scope_steering",
          "title": "README evolution",
          "description": "Documentation scope expanded with onboarding guidance.",
          "evidence": [
            {
              "type": "doc",
              "path": "README.md",
              "commitSha": "cccccccccccccccccccccccccccccccccccccccc",
              "excerpt": "# Fixture Repo"
            }
          ]
        }
      ],
      "claims": [
        {
          "text": "Later commits refined the public docs and entry points.",
          "evidence": [
            {
              "type": "commit",
              "sha": "cccccccccccccccccccccccccccccccccccccccc"
            }
          ]
        }
      ],
      "evidence": [
        {
          "type": "commit",
          "sha": "cccccccccccccccccccccccccccccccccccccccc"
        }
      ]
    }
  ]
}
